[
  {
    "id": "a7b631ef-5813-48b5-a918-42313b72fc40",
    "name": "⚠️ Scoop",
    "storeSection": "Unassigned",
    "aliases": [
      "scoop (25-35g) protein powder, chocolate",
      "scoop (25-35g) protein powder, vanilla",
      "Scoops",
      "scoops (35-50g) protein powder, vanilla"
    ]
  },
  {
    "name": "2% Milk",
    "storeSection": "Dairy",
    "id": "5079765e-94c4-48a2-b5bb-76832194a452",
    "containerSizes": [
      {
        "quantity": 32,
        "unit": "fl oz",
        "label": "1 qt"
      },
      {
        "quantity": 64,
        "unit": "fl oz",
        "label": "½ gal"
      },
      {
        "quantity": 128,
        "unit": "fl oz",
        "label": "1 gal"
      }
    ],
    "conversions": {
      "weightToVolume": {
        "weight": {
          "quantity": 8.5,
          "unit": "oz"
        },
        "volume": {
          "quantity": 1,
          "unit": "cup"
        }
      }
    }
  },
  {
    "id": "6d9a5c17-38da-4e83-825e-913f4c0fe335",
    "name": "All-purpose Flour",
    "storeSection": "Baking",
    "aliases": [
      "Flour"
    ],
    "containerSizes": [
      {
        "quantity": 2,
        "unit": "lb",
        "label": "2 lb bag"
      },
      {
        "quantity": 5,
        "unit": "lb",
        "label": "5 lb bag"
      },
      {
        "quantity": 10,
        "unit": "lb",
        "label": "10 lb bag"
      }
    ],
    "conversions": {
      "weightToVolume": {
        "weight": {
          "quantity": 4.25,
          "unit": "oz"
        },
        "volume": {
          "quantity": 1,
          "unit": "cup"
        }
      }
    }
  },
  {
    "id": "a69c93b6-1c48-4089-b158-eb964d7a8cb4",
    "name": "Almond Butter",
    "storeSection": "Pantry",
    "containerSizes": [
      {
        "quantity": 12,
        "unit": "oz",
        "label": "12 oz jar"
      },
      {
        "quantity": 16,
        "unit": "oz",
        "label": "16 oz jar"
      }
    ],
    "conversions": {
      "weightToVolume": {
        "weight": {
          "quantity": 0.56,
          "unit": "oz"
        },
        "volume": {
          "quantity": 1,
          "unit": "tbsp"
        }
      }
    }
  },
  {
    "id": "650afe11-d62b-4dbc-821a-0ab90fb54481",
    "name": "Almond Milk",
    "storeSection": "Beverages",
    "aliases": [
      "almond milk, unsweetened"
    ],
    "containerSizes": [
      {
        "quantity": 32,
        "unit": "fl oz",
        "label": "1 qt"
      },
      {
        "quantity": 64,
        "unit": "fl oz",
        "label": "½ gal"
      }
    ],
    "conversions": {
      "weightToVolume": {
        "weight": {
          "quantity": 8.5,
          "unit": "oz"
        },
        "volume": {
          "quantity": 1,
          "unit": "cup"
        }
      }
    }
  },
  {
    "id": "efbafc64-695b-4985-a150-636959db7e26",
    "name": "Apple Cider Vinegar",
    "storeSection": "Pantry",
    "containerSizes": [
      {
        "quantity": 16,
        "unit": "fl oz",
        "label": "16 fl oz bottle"
      },
      {
        "quantity": 32,
        "unit": "fl oz",
        "label": "32 fl oz bottle"
      },
      {
        "quantity": 64,
        "unit": "fl oz",
        "label": "64 fl oz bottle"
      }
    ],
    "conversions": {
      "weightToVolume": {
        "weight": {
          "quantity": 8.5,
          "unit": "oz"
        },
        "volume": {
          "quantity": 1,
          "unit": "cup"
        }
      }
    }
  },
  {
    "id": "b998e85c-76d7-400f-8c5f-488101f946d3",
    "name": "Arrabbiata",
    "storeSection": "Pantry",
    "containerSizes": [
      {
        "quantity": 24,
        "unit": "oz",
        "label": "24 oz jar"
      }
    ]
  },
  {
    "id": "4427521f-4ffd-4955-9fe9-680f829c67d8",
    "name": "Asian Noodles",
    "storeSection": "International",
    "containerSizes": [
      {
        "quantity": 14,
        "unit": "oz",
        "label": "14 oz pack"
      },
      {
        "quantity": 16,
        "unit": "oz",
        "label": "16 oz pack"
      }
    ],
    "conversions": {
      "weightToVolume": {
        "weight": {
          "quantity": 3,
          "unit": "oz"
        },
        "volume": {
          "quantity": 1,
          "unit": "cup"
        }
      }
    }
  },
  {
    "id": "65ae3dd9-0681-46b6-9370-bfaa9ceb5aae",
    "name": "Avocado",
    "storeSection": "Produce",
    "aliases": [
      "small avocado, mashed"
    ],
    "containerSizes": [
      {
        "quantity": 1,
        "unit": "each",
        "label": "single"
      },
      {
        "quantity": 4,
        "unit": "each",
        "label": "bag of 4"
      }
    ],
    "conversions": {
      "portionToVolume": {
        "portion": {
          "quantity": 1,
          "description": "medium avocado"
        },
        "volume": {
          "quantity": 0.75,
          "unit": "cup"
        }
      }
    }
  },
  {
    "name": "Baby Portabella Mushrooms",
    "storeSection": "Produce",
    "aliases": [
      "Baby Bella Mushrooms"
    ],
    "id": "7e3fcedd-6afe-47eb-b91e-4a032ccd5b6b"
  },
  {
    "id": "aa4f64b2-419a-4094-b16e-0af823362919",
    "name": "Baking Powder",
    "storeSection": "Baking",
    "containerSizes": [
      {
        "quantity": 6,
        "unit": "oz",
        "label": "6 oz tin"
      },
      {
        "quantity": 8.1,
        "unit": "oz",
        "label": "8.1 oz tin"
      },
      {
        "quantity": 12,
        "unit": "oz",
        "label": "12 oz tin"
      }
    ],
    "conversions": {
      "weightToVolume": {
        "weight": {
          "quantity": 0.14,
          "unit": "oz"
        },
        "volume": {
          "quantity": 1,
          "unit": "tsp"
        }
      }
    }
  },
  {
    "id": "e5c02cc1-313d-4494-aa8d-919d81f4de39",
    "name": "Banana",
    "storeSection": "Produce",
    "containerSizes": [
      {
        "quantity": 1,
        "unit": "each",
        "label": "single"
      },
      {
        "quantity": 1.5,
        "unit": "lb",
        "label": "bunch (~5-6)"
      },
      {
        "quantity": 3,
        "unit": "lb",
        "label": "bag"
      }
    ],
    "conversions": {
      "portionToVolume": {
        "portion": {
          "quantity": 1,
          "description": "medium banana"
        },
        "volume": {
          "quantity": 0.5,
          "unit": "cup"
        }
      }
    }
  },
  {
    "id": "06740da2-2db2-4ad0-97bf-d1fbfc6b8b86",
    "name": "Barilla Protein Pasta",
    "storeSection": "Pantry",
    "containerSizes": [
      {
        "quantity": 12,
        "unit": "oz",
        "label": "12 oz box"
      }
    ],
    "conversions": {
      "weightToVolume": {
        "weight": {
          "quantity": 3.5,
          "unit": "oz"
        },
        "volume": {
          "quantity": 1,
          "unit": "cup"
        }
      }
    }
  },
  {
    "id": "85a1d883-f9bf-45fc-b021-d0a205a3f7df",
    "name": "Basil",
    "storeSection": "Produce",
    "containerSizes": [
      {
        "quantity": 0.75,
        "unit": "oz",
        "label": "small bunch"
      },
      {
        "quantity": 2.5,
        "unit": "oz",
        "label": "large bunch"
      },
      {
        "quantity": 1,
        "unit": "each",
        "label": "potted plant"
      }
    ],
    "aliases": [
      "Basil, chopped"
    ]
  },
  {
    "id": "8b1cd72f-8acd-430d-9a95-ce1c4cbd74b1",
    "name": "Basmati Rice",
    "storeSection": "Pantry",
    "containerSizes": [
      {
        "quantity": 2,
        "unit": "lb",
        "label": "2 lb bag"
      },
      {
        "quantity": 5,
        "unit": "lb",
        "label": "5 lb bag"
      },
      {
        "quantity": 10,
        "unit": "lb",
        "label": "10 lb bag"
      }
    ],
    "conversions": {
      "weightToVolume": {
        "weight": {
          "quantity": 6.5,
          "unit": "oz"
        },
        "volume": {
          "quantity": 1,
          "unit": "cup"
        }
      }
    }
  },
  {
    "id": "59e7fc2b-9417-4bed-ab59-f286bf6cbdb6",
    "name": "Bbq Sauce",
    "storeSection": "Condiments",
    "containerSizes": [
      {
        "quantity": 18,
        "unit": "oz",
        "label": "18 oz bottle"
      },
      {
        "quantity": 28,
        "unit": "oz",
        "label": "28 oz bottle"
      }
    ]
  },
  {
    "id": "588a76bb-e823-4e43-ad64-f8f467998fa3",
    "name": "Beetroot",
    "storeSection": "Produce",
    "aliases": [
      "medium beetroot, grated & cooked"
    ],
    "containerSizes": [
      {
        "quantity": 1,
        "unit": "each",
        "label": "single"
      },
      {
        "quantity": 1,
        "unit": "each",
        "label": "bunch (~3-4)"
      }
    ],
    "conversions": {
      "portionToVolume": {
        "portion": {
          "quantity": 1,
          "description": "medium beetroot"
        },
        "volume": {
          "quantity": 0.5,
          "unit": "cup"
        }
      }
    }
  },
  {
    "id": "3e627cc9-96d5-4803-a0de-a824050ba33b",
    "name": "Berries",
    "storeSection": "Produce",
    "aliases": [
      "berries, fresh",
      "dried berries",
      "fresh or frozen berries",
      "frozen berries"
    ],
    "containerSizes": [
      {
        "quantity": 6,
        "unit": "oz",
        "label": "6 oz clamshell"
      },
      {
        "quantity": 12,
        "unit": "oz",
        "label": "12 oz clamshell"
      },
      {
        "quantity": 16,
        "unit": "oz",
        "label": "1 lb frozen bag"
      }
    ]
  },
  {
    "name": "Black Pepper",
    "storeSection": "Spices",
    "aliases": [
      "Pepper",
      "pepper, to taste",
      "pepper, to tatse"
    ],
    "containerSizes": [
      {
        "quantity": 1.85,
        "unit": "oz",
        "label": "1.85 oz jar"
      },
      {
        "quantity": 3,
        "unit": "oz",
        "label": "3 oz jar"
      },
      {
        "quantity": 6,
        "unit": "oz",
        "label": "6 oz jar"
      },
      {
        "quantity": 1,
        "unit": "oz",